,page_url,image_url,author,title,annotation,genre
126,https://www.biblio-globus.ru/product/10732031,https://static1.bgshop.ru/imagehandler.ashx?width=200&filename=10732031.jpg,Устинова  Т.В.,Камея из Ватикана,"Когда в одночасье вся жизнь переменилась: закрылись университеты, не идут спектакли, дети теперь учатся на удаленке, и из Москвы разъезжаются те, кому есть куда ехать, Тонечка – деловая, бодрая и жизнерадостная сценаристка, и ее приемный сын Родион – страшный разгильдяй и недотепа, но еще и художник, оказываются вдвоем в милом городе Дождеве. Однажды утром этот новый, еще не до конца обжитый, странный мир переворачивается – погибает соседка, пожилая особа, которую все за глаза звали «старой княгиней». И еще из Москвы приезжает Саша Шумакова – теперь новая подруга Тонечки.От чего умерла «старая княгиня»? От сердечного приступа? Не похоже, слишком много деталей указывает на то, что она умирать вовсе не собиралась…И почему на подруг и священника какие-то негодяи нападают прямо в храме?!Местная полиция, впрочем, Тонечкины подозрения только высмеивает. Может, и правда, она, знаменитая киносценаристка, зря все напридумывала?Тонечка и Саша разгадают загадки, а Саша еще и ответит себе на сокровенный вопрос... и обретет любовь! Ведь жизнь продолжается.",Отечественные детективы
127,https://www.biblio-globus.ru/product/10889673,https://static1.bgshop.ru/imagehandler.ashx?width=200&filename=10889673.jpg,Володарская О. ,"Я знаю, кто меня убил","Родителей Паши Субботина убили, когда ему было девять. Их заказали партнеры по бизнесу и присвоили все, что принадлежало семье. Мальчика отправили в детдом, однако спустя два года его забрал к себе брат деда, Эрнест Субботин. Этот гениальный, но очень странный человек жил только любимой наукой — химией. И когда умница Паша не пошёл по его стопам, обиделся... Парень вернулся в Москву, поступил в институт, нашёл жильё, влюбился. Он не виделся с Эрнестом пять лет и даже не созванивался с ним. Но однажды в его квартире как из ниоткуда возник человек и сообщил о том, что Паша — будущий наследник. И кого? Чокнутого профессора! Достанется ему не только запущенная квартира и разваливающейся дача, а нечто настолько ценное, что ради этого могут убить…",Отечественные детективы
128,https://www.biblio-globus.ru/product/10873288,https://static1.bgshop.ru/imagehandler.ashx?width=200&filename=10873288.jpg,Акунин Б.,Статский советник. С иллюстрациями И. Сакурова,"1891 год. Брожение в умах, революционные идеи популярны среди молодёжи, повсюду возникают революционные кружки. Но не для всех это только мода.Группа, называющая себя «Б. Г.» работает точно и дерзко. Убит сибирский генерал-губернатор, убийца — человек, предъявивший документы Эраста Фандорина. Эраст Петрович принимает вызов и берется за расследование. Кто стоит за буквами «Б. Г.»? Что сделало их террористами? Ради чего они совершают свои кровавые преступления?Время действия — 1891 год. Эрасту Фандорину — 35 лет.Предыдущая книга ""Особые поручения""Следующая книга ""Коронация""",Отечественные детективы
129,https://www.biblio-globus.ru/product/10709657,https://static1.bgshop.ru/imagehandler.ashx?width=200&filename=10709657.jpg,Маринина А. А.,Безупречная репутация. Том 1,"Такого странного дела в практике Анастасии Каменской не было давно. Неизвестному писателю Андрею Кислову крупно повезло.  По его единственному роману, изданному за свой счет, хотят снять сериал и предлагают солидный гонорар. Разумеется, тот с радостью соглашается. А потом внезапно объявляет, что не подпишет договор ни на каких условиях. На кону большие деньги, и к выяснению причин столь загадочного отказа привлекают сотрудника частного детективного агентства - Настю Каменскую. Но вскоре та становится главным подозреваемым в деле об убийстве. Конечно, ну а кто же еще! Ведь это она – Настя - грязно домогалась потерпевшего, угрожала ему... Он сам рассказывал об этом перед смертью, да и другие свидетели имеются…",Отечественные детективы
130,https://www.biblio-globus.ru/product/10891240,https://static1.bgshop.ru/imagehandler.ashx?width=200&filename=10891240.jpg,Осипенко В.В. ,Личный враг Геринга,"1942 год. К обозу нашего авиационного полка прибился необычный попутчик. «Дед» - так в шутку прозвали нового сослуживца летчики и определили его в помощь механикам. Но чем дальше новичок показывал свое умение, тем очевиднее становилось, что это не простой беженец. Глубокие технические знания, безупречная дисциплина и выправка выдавали в нем военного. На прямые вопросы о себе Павел Бессонов отвечал уклончиво. Особисты терялись в догадках, кто он на самом деле. Тайна оставалась неразгаданной до тех пор, пока однажды над советским аэродромом внезапно не появились фашистские истребители…",Отечественные детективы
131,https://www.biblio-globus.ru/product/10887899,https://static1.bgshop.ru/imagehandler.ashx?width=200&filename=10887899.jpg,Свечин Н. ,Как Лыков не стал генералом,"В сборник известного автора исторических детективов Николая Свечина вошли хорошо известные рассказы и одна новая повесть - все из цикла расследований Алексея Лыкова. Если вы думаете, что искусство экорта - явление современности, то вы ошибаетесь. Им владели женщины еще во времена Империи, в которой даже Великий князь не был чужд плотских утех. Интрига, связанная с его любовницей, легла в основу повести. Как быть женщине, если у нее два любовника, вы выбрать нужно одного? возможно едиснтвенный выход - исчезнуть из числа живых...",Отечественные детективы
132,https://www.biblio-globus.ru/product/10871748,https://static1.bgshop.ru/imagehandler.ashx?width=200&filename=10871748.jpg,Маринина  А.,Тьма после рассвета,"Ноябрь 1982 года. Годовщина свадьбы супругов Смелянских омрачена смертью Леонида Брежнева. Новый генсек – большой стресс для людей, которым есть что терять. А Смелянские и их гости как раз из таких – настоящая номенклатурная элита. Но это еще не самое страшное. Вечером их тринадцатилетний сын Сережа и дочь подруги Алена ушли в кинотеатр и не вернулись…После звонка «с самого верха», к поискам пропавших детей подключают майора милиции Виктора Гордеева. От быстрого и, главное, положительного результата зависит его перевод на должность замначальника «убойного» отдела. Но какие тут могут быть гарантии? А если они уже мертвы? Тем более в стране орудует маньяк, убивающий подростков 13-16 лет. И друг Гордеева – сотрудник уголовного розыска Леонид Череменин - предполагает худшее. Впрочем, у его приемной дочери - недавней выпускницы юрфака МГУ Насти Каменской - иное мнение: пропавшие дети не вписываются в почерк серийного убийцы. Опера начинают отрабатывать все возможные версии. А потом к расследованию подключаются сотрудники КГБ…",Отечественные детективы
133,https://www.biblio-globus.ru/product/10907869,https://static1.bgshop.ru/imagehandler.ashx?width=200&filename=10907869.jpg,Акунин Б.,Алмазная колесница с иллюстрациями И. Сакурова,"Книга издана в двух томах под одной обложкой. Первый том начинается в 1905 году, со встречи со штабс-капитаном Рыбниковым, знакомым нам по повести Куприна. Русско-японская война, в России весьма успешно работает сеть японских агентов, но на пути у них встает опытный и умудренный годами Эраст Петрович Фандорин.",Отечественные детективы
134,https://www.biblio-globus.ru/product/10828434,https://static1.bgshop.ru/imagehandler.ashx?width=200&filename=10828434.jpg,Донцова  Д.А.,Бабулька на горошине,"Человек, который начал вести здоровый образ жизни, часто выглядит нездоровым. Вот и мама Ивана Павловича напугала сына своей худобой. Оказывается, Николетта очаровалась колдуном, который посадил ее на диету и пообещал исполнение всех желаний! Мало Подушкину хлопот с маменькой, так еще и новая клиентка Татьяна Димкина обратилась за помощью. Дело в том, что ее брат Яша, его жена Ольга и трое сыновей отравились угарным газом и погибли. Брат Ольги – настоятель храма, и накануне к нему приезжал какой-то тип и требовал вернуть полмиллиона рублей, которые якобы занял у него Яков. Татьяна считает, что это он убил семью брата, закрыв в печи заслонку. Подушкин провел расследование,  и был потрясен узнав, кто на самом деле оказался убийцей!",Отечественные детективы
135,https://www.biblio-globus.ru/product/10794297,https://static1.bgshop.ru/imagehandler.ashx?width=200&filename=10794297.jpg,Маринина  А.,Отдаленные последствия. Том 2,"Вы когда-нибудь слышали о термине «рикошетные жертвы»? Нет, это вовсе не те, в кого срикошетила пуля. Так называют ближайшее окружение пострадавшего. Членов семей погибших, мужей изнасилованных женщин, родителей попавших под машину детей… Тех, кто часто страдает почти так же, как и сама жертва трагедии… В Москве объявился серийный убийца. С чудовищной силой неизвестный сворачивает шейные позвонки одиноким прохожим и оставляет на их телах короткие записки: «Моему Учителю». Что хочет сказать он миру своими посланиями? Это лютый маньяк, одержимый безумной идеей? Или члены кровавой секты совершают ритуальные жертвоприношения? А может, обычные заказные убийства, хитро замаскированные под выходки сумасшедшего? Найти ответы предстоит лучшим сотрудникам «убойного отдела» МУРа – Зарубину, Сташису и Дзюбе. Начальство давит, дело засекречено, времени на раскрытие почти нет, и если бы не помощь легендарной Анастасии Каменской... Впрочем, зацепка у следствия появилась: все убитые когда-то совершили грубые ДТП с человеческими жертвами, но так и не понесли заслуженного наказания. Не зря же говорят, что у каждого поступка в жизни всегда бывают последствия. Возможно, смерть лихачей – одно из них?",Отечественные детективы
136,https://www.biblio-globus.ru/product/10781932,https://static1.bgshop.ru/imagehandler.ashx?width=200&filename=10781932.jpg,Акунин Б.,Не прощаюсь: Приключения Эраста Фандорина в ХХ веке. Часть вторая.,"Последний роман Бориса Акунина в фандоринской серии. Время действия романа - 1918-1920Предыдущая книга — ""Планета вода""",Отечественные детективы
137,https://www.biblio-globus.ru/product/10909631,https://static1.bgshop.ru/imagehandler.ashx?width=200&filename=10909631.jpg,"Литвинова А.В., Литвинов С.В. ",Смерть за добрые дела,"Библиотекарь Надя Митрофанова по секрету от своего возлюбленного, журналиста Димы Полуянова, вступила в тайное общество. Ничего противозаконного: там безвозмездно помогают обычным людям, попавшим в беду. Но добрые дела не остаются безнаказанными. Происходит убийство, и Надя оказывается в смертельной опасности. Девушка спешит за помощью к Диме. Они вместе решают найти и разоблачить злодея, но не подозревают, что теперь на кону стоит их честь и сама жизнь…",Отечественные детективы
138,https://www.biblio-globus.ru/product/10863673,https://static1.bgshop.ru/imagehandler.ashx?width=200&filename=10863673.jpg,Чиж А. ,Формула преступления,"1985 год. Пока искалеченный в погонях за преступниками коллежский секретарь Родион Ванзаров приходит в себя, его напарник и друг криминалист Аполлон Лебедев вспоминает самые «горячие» детективные расследования, которые они провели вместе. Полиция, словно исповедник, становится свидетелем самых страшных человеческих грехов: под личиной тихого обывателя может скрываться чудовище. Вот убийство на фоне противоестественной половой склонности; вот мертвый муж встает из могилы, чтобы отомстить распутной жене-баронессе; а вот пир во время чумы, когда красивейшего мужчину убивают в разгаре празднества…Рискуя жизнью, Ванзаров и Лебедев окунаются в пучину порока, чтобы восстановить справедливость! Российская империя может спать спокойно.",Отечественные детективы
139,https://www.biblio-globus.ru/product/10860971,https://static1.bgshop.ru/imagehandler.ashx?width=200&filename=10860971.jpg,Лосева Л. ,Правый берег Егора Лисицы,"Начало НЭПа. На пути из Таганрога сгорел и почти полностью затонул пассажирский пароход. Егор Лисица – сотрудник новой советской милиции — в качестве судебного врача занят опознанием тел погибших. Однако среди них не удается найти тело чиновника из Стройтреста и его жены. Их имена есть в списке пассажиров, но ни среди мертвых, ни среди живых нет их самих. Чуть позже чиновника находят в городской больнице. От удара по голове и долгих часов в холодной воде он потерял память. Где его жена, он не знает, да и ее саму не помнит…",Отечественные детективы
140,https://www.biblio-globus.ru/product/10789416,https://static1.bgshop.ru/imagehandler.ashx?width=200&filename=10789416.jpg,Маринина  А.,Отдаленные последствия. Том 1,"Вы когда-нибудь слышали о термине «рикошетные жертвы»? Нет, это вовсе не те, в кого срикошетила пуля. Так называют ближайшее окружение пострадавшего. Членов семей погибших, мужей изнасилованных женщин, родителей попавших под машину детей… Тех, кто часто страдает почти так же, как и сама жертва трагедии… В Москве объявился серийный убийца. С чудовищной силой неизвестный сворачивает шейные позвонки одиноким прохожим и оставляет на их телах короткие записки: «Моему Учителю». Что хочет сказать он миру своими посланиями? Это лютый маньяк, одержимый безумной идеей? Или члены кровавой секты совершают ритуальные жертвоприношения? А может, обычные заказные убийства, хитро замаскированные под выходки сумасшедшего? Найти ответы предстоит лучшим сотрудникам «убойного отдела» МУРа – Зарубину, Сташису и Дзюбе. Начальство давит, дело засекречено, времени на раскрытие почти нет, и если бы не помощь легендарной Анастасии Каменской... Впрочем, зацепка у следствия появилась: все убитые когда-то совершили грубые ДТП с человеческими жертвами, но так и не понесли заслуженного наказания. Не зря же говорят, что у каждого поступка в жизни всегда бывают последствия. Возможно, смерть лихачей – одно из них?",Отечественные детективы
141,https://www.biblio-globus.ru/product/10781933,https://static1.bgshop.ru/imagehandler.ashx?width=200&filename=10781933.jpg,Акунин Б.,Планета вода. Приключения Эраста Фандорина в ХХ веке. Часть первая.,"Приключения Эраста Петровича Фандорина в XX веке. Часть первая. В книгу вошло три детектива: технократический, ностальгический и идиотический. Действие происходит в 1902–1912 годах.Предыдущая книга — ""Черный город""",Отечественные детективы
142,https://www.biblio-globus.ru/product/10645081,https://static1.bgshop.ru/imagehandler.ashx?width=200&filename=10645081.jpg,Маркарьян Р.В.,Ключевая фраза,"Основанный на реальных событиях, мистический и конспирологический детектив написан известным российским адвокатом, принимавшим участие в ряде громких судебных дел и сделавшимся лицом популярных телепроектов ""Суд присяжных"" и ""Окончательный вердикт"". На поиски фразы, управляющей умами присяжных, и библейского артефакта, дающего власть над судебной системой, автор отправляет адвоката Артема Каховского. В водовороте криминальных событий герои романа пытаются постичь тайные основы жизни и судьбы.",Отечественные детективы
