,page_url,image_url,author,title,annotation,genre
366,https://www.biblio-globus.ru/product/10892967,https://static1.bgshop.ru/imagehandler.ashx?width=200&filename=10892967.jpg,Слотер К.,Осколки прошлого,"Андреа Оливер думает, что знает о своей матери все. У Лоры никогда не было от нее секретов: живет тихой и счастливой жизнью в маленьком прибрежном городке Белль-Айл, работает логопедом и дружит со всеми соседями. По крайней мере, такой ее всегда знала Андреа – спокойной, заботливой и жизнерадостной.Но все меняется, когда на них жестоко нападают в кафе. Лора совершает то, чего дочь и представить себе не могла, – спокойно расправляется с нападающим. Неужели мама способна на такое хладнокровие и жестокость? Как будто стала совершенно другим человеком.Так и есть. Почти тридцать лет Лора скрывалась от себя прежней, затаилась в надежде, что ее никто и никогда не найдет. И вот она разоблачена. Теперь им обеим грозит опасность, но Лора отказывается говорить с дочерью. Андреа придется самой, по кусочкам, раскрыть секреты прошлого матери, чтобы спасти их обеих. И время ее на исходе…",Ужасы
367,https://www.biblio-globus.ru/product/10900272,https://static1.bgshop.ru/imagehandler.ashx?width=200&filename=10900272.jpg,Даунинг Хаан М. ,Когда Хелен придёт,"Когда вся наша семья переехала в новый дом, когда-то бывший церковью, мы с Майклом думали, что ничего хуже быть не может. Но тут оказалось неплохо. Если бы не Хизер, наша младшая сестричка! Она твердит, что подружилась с призраком по имени Хелен. Конечно, мы не поверили ей. Но у Хизер появился новый старинный медальон, а ещё кто-то разгромил наши комнаты. Хизер пугает меня. Но что если опасность грозит прежде всего ей?..",Ужасы
368,https://www.biblio-globus.ru/product/10809061,https://static1.bgshop.ru/imagehandler.ashx?width=200&filename=10809061.jpg, Винтер Ф.,Барсук,"Скандинавский детективный триллер с элементами сверхъестественного. О человеческой психике, столь хрупкой, когда на нее давят.Каждый год 6 ноября случается ужасное убийство. Преступник по прозвищу Барсук утаскивает жертву через дыру в полу подвала и не оставляет никаких следов.В это время в успешном когда-то издательстве назрел финансовый кризис: если срочно не издать бестселлер, то издательство разорится. Однажды утром издательница Анника находит на лестнице комочки земли и перепачканную рукопись с исповедью убийцы. Несмотря на моральные сомнения, Анника издает рукопись...Отчаянное решение приведет к самым неожиданным последствиями, в том числе и для самой Анники.Для кого эта книга:Для любителей напряженных детективов, триллеров и скандинавской атмосферы. Любителям Диккера и Бюсси.",Ужасы
369,https://www.biblio-globus.ru/product/10809771,https://static1.bgshop.ru/imagehandler.ashx?width=200&filename=10809771.jpg,,Мистические истории. Призрак и костоправ,"Собранные в этой книге мистические истории английских и американских писателей созданы в XIX – начале XX века – эпоху расцвета жанра страшного рассказа в литературе Старого и Нового Света. Таинственные, непостижимые, леденящие кровь, а иногда и курьезные происшествия, поведанные в этих повествованиях, ставят героев в экстраординарные, бросающие в дрожь, подчас смертельно опасные ситуации, приоткрывают дверь в потусторонние и инфернальные измерения бытия, возрождают к жизни выходцев с того света, древнее хтоническое зло, темные магические ритуалы, суеверия и колдовство былых времен. За покровом обыденной реальности авторы рассказов (среди которых такие мастера, как Джозеф Шеридан Ле Фаню, Маргарет Олифант, Монтегю Родс Джеймс, Эдвард Фредерик Бенсон, Джон Бакан) обнаруживают жутковатый готический мир, опровергающий рациональные философские и научные построения и самоуверенные претензии на всезнание, присущие человеку Нового времени.",Ужасы
370,https://www.biblio-globus.ru/product/10767560,https://static1.bgshop.ru/imagehandler.ashx?width=200&filename=10767560.jpg,Аракелян К.,Страшные истории. Не оставайся один в темноте…,"Ты думаешь, что гулять по заброшенному зданию — это интересно и весело? Но твои плечи начнет сжимать костлявая рука и плоть будут пронзать холодные иглы страха. Ты думаешь, что волшебная вещь принесет счастье своему владельцу? Но его слова путаются, переходят в крик и волчий вой, глаза наливаются кровью, он бормочет как сумасшедший, скаля зубы, и хочет принести тебя в жертву своему маленькому идолу! Ты думаешь, что пережить встречу с потусторонним миром было бы прикольно? Спроси у тех, кто пропал без вести, сошел с ума или превратился в кровавое месиво…В этой книге мистический блогер Карина Аракелян собрала самые страшные истории, которые произошли с ней самой, ее семьей и ее подписчиками. Тьма коснулась их, и Карина говорит их голосом.Тебе необязательно подвергать себя опасности в реальной жизни, чтобы утолить свой интерес, достаточно прочесть книгу. А Карина расскажет о том, как можно распознать потенциально чудовищные ситуации, как подчинить себе страх и жить дальше.",Ужасы
371,https://www.biblio-globus.ru/product/10888349,https://static1.bgshop.ru/imagehandler.ashx?width=200&filename=10888349.jpg,Постнов О.,Страх,"Олег Постнов - тонкий стилист и блестящий мистификатор, ""типичный русский Борхес"", по определению Льва Данилкина. Роман ""Страх"" наследует лучшим традициям русской готики Карамзина, Гоголя, Погорельского и Булгакова.Русский эмигрант, забредший в букинистическую лавку в Америке, становится обладателем нескольких рукописных тетрадей. В них - история одной жизни и одной любви на грани одержимости. Украинское село, куда героя ребенком отправляют на каникулы, - полумистическое пространство, полное чудес и предрассудков. Здесь и встреча с марой, и свадьба деревенской ведьмы, и странные ритуальные обряды.Это книга об испытании страхом, который иногда оказывается сильнее и побеждает, о персональном кошмаре, выбраться из которого невероятно трудно, если вообще возможно.",Ужасы
372,https://www.biblio-globus.ru/product/10873453,https://static1.bgshop.ru/imagehandler.ashx?width=200&filename=10873453.jpg,Маццола А.,Заводная девушка,"Париж. Зима 1750 года. В надежде на лучшую жизнь бывшая проститутка Мадлен устраивается горничной в дом знаменитого часовщика Рейнхарта. По заданию полиции девушка должна выяснить, чем в действительности занимается часовщик, ведь по городу ходят упорные слухи, будто Рейнхарт создает свои диковинные механизмы— украшенных драгоценностями птиц, серебряных пауков, кроликов, летучих мышей — с помощью магии, бросая вызов законам природы. Но в доме часовщика Мадлен чувствует себя крайне неуютно: ей кажется, будто она постоянно под прицелом чужих глаз. События принимают еще более зловещий оборот, когда с улиц начинают исчезать дети. Мадлен, исполненная решимости выяснить правду, с ужасом понимает, что, возможно, имеет дело с заговором, который ведет в самое сердце Версаля. Но что лежит в основе этого заговора? Кто такая заводная девушка? И что на самом деле ищет Мадлен? «Заводная девушка» – это потрясающая история об одержимости, иллюзиях и цене свободы. Впервые на русском языке!",Ужасы
373,https://www.biblio-globus.ru/product/10849166,https://static1.bgshop.ru/imagehandler.ashx?width=200&filename=10849166.jpg,Лаймон Р. ,Одной дождливой ночью,"Странный черный дождь саваном накрыл маленький городок Биксби. Теплые густые капли облепляют кожу, просачиваются сквозь одежду, везде оставляя свой след. И любой попавший под этот ливень – меняется. Человека начинают переполнять ненависть, ярость, жестокость и неутолимая жажда убивать всех тех, кто сумел остаться сухим. Дружелюбные соседи превращаются в безумных маньяков. Люди, стоявшие в очереди перед кинотеатром, врываются в зал и расправляются там с беззащитными зрителями. И лишь несколько человек в силу разных обстоятельств остаются в здравом уме. Теперь жизнь этих людей превращается в игру на выживание с совершенно непредсказуемым результатом, а единственный путь к спасению – найти истоки проклятия, поразившего Биксби, и при этом не попасть под дождь, так как сопротивляться его действию невозможно.",Ужасы
374,https://www.biblio-globus.ru/product/10800523,https://static1.bgshop.ru/imagehandler.ashx?width=200&filename=10800523.jpg,,Адские чары.,"Самые захватывающие произведения, входящие в «золотой фонд» мировой литературы ужасов. Любители пощекотать себе нервы не должны проходить мимо этой серии! На страницах книг оживут самые страшные ночные кошмары, от древних богов Лавкрафта до ведьм Гоголя. Читатель прикоснётся к древним оккультным тайнам, посетит ужасные и таинственные миры, созданные фантазией великих писателей. Не читайте эти книги на ночь!",Ужасы
375,https://www.biblio-globus.ru/product/10121575,https://static1.bgshop.ru/imagehandler.ashx?width=200&filename=10121575.jpg,Страуд Дж.,Кричащая лестница,"Меня зовут Люси Карлайл и я работаю в агентстве ""Локвуд и компания"". Нас всего трое: я, Энтони (он же Локвуд) и Джордж. Мы занимаемся тем, что ловим призраков и спасаем от них Лондон. Вообще-то, это только звучит просто, на самом деле все гораздо сложнее. Существует великое множество призраков и их разновидностей, и большинство из них смертельно опасны, и даже наше супероружие: рапиры, железные цепи и банки с греческим огнем - не всегда эффективно. Впрочем, в нашем агентстве трусов нет. На этот раз Локвуд решил отправиться в старинный дом, который вот уже много веков населяют призраки и где находится знаменитая на всю округу Кричащая лестница. С наступлением темноты она издает чудовищные крики. Но есть маленькая проблемка - никто и никогда не выходил из этого особняка живым, а все предыдущие агенты, пытавшиеся разгадать его тайну, погибли. Может, мы просто чокнутые, что взялись за это дело?",Ужасы
376,https://www.biblio-globus.ru/product/10922679,https://static1.bgshop.ru/imagehandler.ashx?width=200&filename=10922679.jpg,Нури А. ,По разные стороны вечности,"Магда попала в аварию, которой совсем не помнит из-за амнезии, и пережила клиническую смерть. После этого меняются вкусы Магды, невесть откуда накатывают воспоминания о том, что ей никак не может быть известно… Эти знания приходят внезапно, управлять ими она не может, удержаться и не сообщить окружающим – тоже. Соседка уговаривает Магду обратится к знакомой ясновидящей, но из этого визита ничего хорошего не выходит — в приемной на нее набрасывается одна из посетительниц. Она кричит, что Магда не живая и ей здесь не место…",Ужасы
377,https://www.biblio-globus.ru/product/10928188,https://static1.bgshop.ru/imagehandler.ashx?width=200&filename=10928188.jpg,Мартин И. ,Пусть это буду я,"Восемнадцатилетним двойняшкам Коле и Люсе поступает предложение от известного писателя Гончара: стать прототипами героев его новой книги. Взамен он обещает им гонорар, проживание в старинном особняке в центре Москвы, интересное общество и перспективы.От ребят не требуется ничего, кроме доверительного разговора.Брату с сестрой, выросшим без родительской заботы, возможность прикоснуться к богемной столичной жизни кажется чем-то поистине волшебным.Вот только позже выясняется, что дом писателя полон секретов, странных жильцов, распорядков и правил. Внутренние двери запрещено запирать на ключ, пропуск обеда грозит обернуться наказанием, а существование пятого этажа и вовсе не принимается в расчет.Со временем двойняшки понимают, что и у писателя на них совсем другие планы. Но какие тайны хранят постояльцы дома? И что их всех связывает?",Ужасы
378,https://www.biblio-globus.ru/product/10918545,https://static1.bgshop.ru/imagehandler.ashx?width=200&filename=10918545.jpg,Нури А. ,Дорога в мир живых,"Катя долго приходила в себя после развода. Она слишком сильно любила мужа и не оставляла надежды, что он вернется. Подруга посоветовала ей найти другого мужчину, зарегистрировавшись на сайте знакомств, и Катя после долгих колебаний так и поступила. Никита казался воплощением идеала: симпатичный, вежливый, он разделял все увлечения Кати, поддерживал ее, с ним она позволила себе не вспоминать о бывшем муже. Но слишком поздно она поняла, что за профилем на сайте может скрываться кто угодно, может быть, и вовсе не человек…",Ужасы
379,https://www.biblio-globus.ru/product/10916932,https://static1.bgshop.ru/imagehandler.ashx?width=200&filename=10916932.jpg,Скай Эдвард ,Записки ночного ангела.,"Видя объявления «Пропал человек» в соцсетях или на автобусной остановке, большинство подумает: «Как я-то могу помочь?» Большинство, но не все. Есть люди — настоящие люди, — готовые в любое время дня в самую разную погоду отправиться на поиски. Именно они составляют основу Добровольческого поисково-спасательногоотряда «Лиза Алерт».Эвард Скай — профессиональный пилот, член вертолетного поискового-спасательного отряда «Ангел», работающего в составе «Лиза Алерт». С детства мечтая о небе, автор выбрал для себя жизнь, наполненную адреналином, — вести вертолет сквозь ночь, непроглядный туман или тяжелый дым лесных пожаров. И лишь с одной целью — отыскать и спасти того, кто так в этом нуждается.В книге собраны реальные истории — искренние, полные переживаний рассказы о том, как оставаться человеком, несмотря ни на что.",Ужасы
380,https://www.biblio-globus.ru/product/10911393,https://static1.bgshop.ru/imagehandler.ashx?width=200&filename=10911393.jpg,Тимошенко Н.В. ,Казаки-разбойники (Игры со смертью #5),"Вот уже больше полугода таинственный маг играет с Яной Васильевой, присылая ей подарки и подбрасывая ее друзьям необычные расследования. Новая игра не заставила себя долго ждать: на пороге своего дома Яна находит коробку с мумифицированной рукой, а на дороге неподалеку появляется призрак девушки с собакой. Пытаясь выяснить, если ли связь между этими событиями, Яна обнаруживает череду настолько пугающих совпадений, что возникает вопрос: человеческих ли рук это дело или же в ход событий вмешалось нечто сверхъестественное? Ставки в последней игре высоки как никогда, а смерть уже дышит в затылок. Сможет ли Яна побороть страх и спасти себя и друзей или же кем-то придется пожертвовать?",Ужасы
381,https://www.biblio-globus.ru/product/10908355,https://static1.bgshop.ru/imagehandler.ashx?width=200&filename=10908355.jpg,Брандт Д. ,Легенда о старом маяке,"Гленнон гостит у дяди, работающего смотрителем маяка на таинственном острове, окутанном туманом. Однажды мальчик становится свидетелем кораблекрушения и видит, как спасаются несколько моряков. Но лица у них совсем бледные, а ещё они страшно боятся местного кота... Тем временем жители острова готовятся к какому-то жуткому празднику. Поговаривают, что после праздника с острова уже никому не выбраться... Неужели мальчику придётся остаться здесь навсегда?",Ужасы
382,https://www.biblio-globus.ru/product/10907035,https://static1.bgshop.ru/imagehandler.ashx?width=200&filename=10907035.jpg,Корсакова Т. ,Хрустальное сердце,"Судьба была жестока к Максу Легостаеву, подбросив едва ли не под колеса его автомобиля странную девицу. Вообще-то незнакомки, пусть даже симпатичные, Легостаева не волновали, ведь его сердце уже принадлежало ведущей музканала ослепительной Лоре Лайт. Однако спасать девицу пришлось, а там уж вступил в действие принцип: «ты в ответе за тех, кого спас», и Макс понял, что у судьбы, очевидно, имелись свои резоны…",Ужасы
