,page_url,image_url,author,title,annotation,genre
245,https://www.biblio-globus.ru/product/10862293,https://static1.bgshop.ru/imagehandler.ashx?width=200&filename=10862293.jpg,Донцова Д.А. ,Закон молодильного яблочка,"Виола Тараканова собралась замуж за своего верного Степана! Пока жених в командировке, невеста опять вляпалась в историю. Прямо на глазах у Виолы в ресторане убивают мать олигарха Ферина, заказавшего писательнице создать книгу по его сюжету. Причем стреляет бывший одноклассник бизнесмена! С чего вдруг тихий историк-архивист взялся за пистолет?.. Конечно, чтобы разобраться в этой истории, Виола Тараканова полезет в гущу событий, а там обнаружится та-а-акое... Никаких «вдруг» не бывает, все в нашей жизни закономерно – действие равно противодействию. А если проще – как аукнется, так и откликнется. Сделал что-то дурное в юности, это дурное тебя через много лет настигнет…",Иронические детективы
246,https://www.biblio-globus.ru/product/10844621,https://static1.bgshop.ru/imagehandler.ashx?width=200&filename=10844621.jpg,Донцова Д.А. ,Имидж напрокат. Коронный номер мистера X,"Имидж напрокатНадо же было Евлампии Романовой так удачно упасть с лестницы – ничего не повредила, только головой немного стукнулась. Правда, подруга уложила-таки ее по блату в дорогой реабилитационный центр. В первый же день, отправившись на экскурсию по бывшему имению графа Милова, где сейчас находится клиника, Лампа стала свидетелем гибели одной из пациенток. Чтобы прийти в себя, вышла Лампа в старинный парк, дошла до беседки, а там... натолкнулась на очередную загадку. Кому принадлежит механический голос из забытого кем-то телефона? И загадок тех целый букет. Откуда в Москве взялся заморский жук-древоточец? Что означают черепушки на браслете медсестры? Как монашка может быть чьей-то прапрабабушкой?  Сложно Лампе со слегка сотрясенной головушкой найти ответы. Но ничего невозможного нет!Коронный номер мистера ХДетектив Иван Подушкин помимо воли оказался втянут в весьма запутанное дело. К нему в офис пришла дочь и ассистентка знаменитого фокусника Генриха Донелли. Светлана жутко напугана: в ее голове звучит голос, который требует, чтобы она выбросилась из окна. Девушка, волнуясь, рассказала, как однажды ночью в ее спальню вошел бородатый мужчина и сделал ей за ухом укол. С тех пор ее и преследует голос. Иван решил, будто перед ним сумасшедшая, и отказал в помощи. Света убежала, оставив в прихожей гонорар. А через несколько минут девушка выбросилась из окна соседнего дома. Когда частный детектив спустился на улицу, уже прибыла полиция. В ходе непростого и опасного следствия Ивану Подушкину и следователю Варваре Косовой пришлось убедиться, что без фокусов в этом таинственном деле не обошлось...",Иронические детективы
247,https://www.biblio-globus.ru/product/10844990,https://static1.bgshop.ru/imagehandler.ashx?width=200&filename=10844990.jpg,Полякова Т.В. ,Невинные дамские шалости,"Разве это не злая насмешка судьбы - встретить мужчину своей мечты, а через пару часов стать свидетелем его страшной смерти? Неведомые убийцы в масках расстреливают красавца блондина прямо на глазах у Татьяны. Она чудом спасается от их преследования, но ее жизнь с этого мгновения превращается в ад. Покушения следуют одно за другим, таинственным образом исчезает любимая подруга... Но все же есть один шанс остаться в живых, и Татьяна не намерена его упускать...",Иронические детективы
248,https://www.biblio-globus.ru/product/10835938,https://static1.bgshop.ru/imagehandler.ashx?width=200&filename=10835938.jpg,Вита Виктория,Non-Stop — не останавливайся,"Иногда бывает все настолько плохо, что посещают мысли: наверное, в прошлой жизни так грешила, что в этой наказана нелегкой женской долюшкой. И мчится жизнь, как обезумевший скакун, потерявший узду. Дом, работа, личная жизнь — все катится в тартарары. Да еще предательства, убийства, похищения, нешуточные страсти прошлого и настоящего накрывают с головой в самый неожиданный момент, и кажется, что нет никакого выхода — «есть только вход, и то — не тот».Но они женщины, и для них нет ничего невозможного. Разный возраст, круг интересов, профессии и образ жизни — врач и адвокат, переводчик и школьница, бывшая балерина и любовница олигарха. Каждая из них оказалась не в то время и не в том месте, и закрутила их жизнь в едином смертельном водовороте. Что их поддерживает — вера друг в друга и, конечно, в себя… А у неизвестных деньги, сила, оружие и неутолимая жажда убивать.И будет новое утро, и будет новый день, только кто его увидит?",Иронические детективы
249,https://www.biblio-globus.ru/product/10821440,https://static1.bgshop.ru/imagehandler.ashx?width=200&filename=10821440.jpg,Вита В.,Этот сильный слабый пол,"Увлекательный, динамичный, иронический детектив, где главные героини – женщины, обременённые бытом, работой, личной неустроенностью, – внезапно оказываются в вихре таинственных, порой кровавых событий, угрожающих их жизни. Книга поможет отвлечься от сиюминутных проблем и отдохнуть от повседневных забот, получить заряд хорошего настроения и дать надежду, что всё будет хорошо, потому что иначе быть не может.«Три женщины. Варвара – хирург; Татьяна – гинеколог; и Ольга – терапевт. Их объединяет не только медицина, но ещё и приближение кризиса среднего возраста… и не сложившаяся личная жизнь. Но разве это повод опускать руки и унывать? В один момент жизнь их закрутила смертельным водоворотом. Они пройдут через кровь и огонь, через боль потерь и страдания – они станут другими. Но чего не будет – так это безропотного смирения и покорности надвигающимся неприятностям. Рано или поздно всё тайное станет явным, и к унылому прошлому уже не будет возврата...»",Иронические детективы
250,https://www.biblio-globus.ru/product/10774924,https://static1.bgshop.ru/imagehandler.ashx?width=200&filename=10774924.jpg,Донцова  Д.А.,Вакантное место райской птички,"Правда ли, что некоторые дома приносят своим владельцам горе? Даша Васильева не боится черных кошек, не опасается цифры тринадцать, любит понедельники и не верит в проклятые дома. Но особняк, который соседствует с ее коттеджем, на самом деле несчастливый. В нем постоянно меняются хозяева и со всеми произошло нечто нехорошее. Вот и сейчас у Карины Буркиной, очередной владелицы злосчастного подмосковного дворца, пропал младший сын Валерий. Свекровь хозяйки Светлана Алексеевна прибежала к Даше за помощью. Васильева согласилась помочь Буркиным. И тут выясняется, что полковник Дегтярев давно знает эту семью, и познакомился с ними при весьма странных обстоятельствах: много лет назад Светлана Алексеевна, попросила Дегтярева помочь изменить фамилию невестки, а внуку Кирюше еще и отчество! Даша уверена, что эти ниточки из прошлого помогут в поисках Валерия. Но сейчас она понимает как справедлива пословица: маленькие детки - маленькие бедки, подросли детки - подросли и бедки.",Иронические детективы
251,https://www.biblio-globus.ru/product/10906848,https://static1.bgshop.ru/imagehandler.ashx?width=200&filename=10906848.jpg,Логунова Е.И. ,"Маска, я вас знаю!","Писательница Елена и ее боевая подружка Ирка снова в деле! Выходя от Лены, Ирка случайно попала в подвал и заметила там труп, любовно упакованный в синий мешок для мусора. Но, вернувшись туда вместе, подруги ничего не обнаружили! А вскоре в доме, где живет Лена, произошло несколько странных событий: соседи одновременно получили компромат на свои вторые половинки. В одной семье это закончилось трагически: бизнесмен Золотухин умер во время ссоры. Причиной смерти стал яд, которым оказался начинен зуб несчастного! Неужели это такой изощренный способ покончить с собой? Что-то подсказывает сыщицам: не все так просто!",Иронические детективы
252,https://www.biblio-globus.ru/product/10894771,https://static1.bgshop.ru/imagehandler.ashx?width=200&filename=10894771.jpg,Донцова Д.А. ,Родословная до седьмого полена. Гороскоп птицы Феникс,"Родословная до седьмого поленаНичего себе пердимонокль! Оказывается, рядом с домом любительницы частного сыска Даши Васильевой расположены «графские развалины». Случайно обнаружившая их Даша наткнулась рядом с ними на надгробные плиты и труп молодого мужчины! Конечно, Васильевой к трупам не привыкать! Но это был уже явный перебор, ведь утром того же дня на пороге Дашиного дома скончалась совершенно незнакомая женщина, зачем-то заявившаяся к ней в гости.  Полковник Дегтярев категорически не хочет посвящать Дашу в детали расследования, и любительница частного сыска решает распутать загадочное со всех сторон дело сама и утереть полковнику нос!..Гороскоп птицы ФениксПодруга, как всегда, подбросила проблему – попросила на время приютить ее папу и маленькую собачку. Так в доме Евлампии Романовой поселился профессор психологии Барабан Сосисович, как его дружно принялись называть все члены семьи, и чихуахуа Антонина. И вот теперь холодильник забит одними сосисками, Лампа выращивает какое-то диковинное растение и круглосуточно слушает детские музыкальные книжки. А ей, между прочим, преступников надо ловить. В их с Максом детективное агентство обратилась Елена Рыльская, у которой погибла за короткий срок вся семья, и количество жертв продолжает расти. Только Евлампия поговорит с полезным свидетелем, как тот сразу оказывается на больничной койке или в морге. Что же такое происходит? И при чем здесь дорогущие шоколадные конфеты?..",Иронические детективы
253,https://www.biblio-globus.ru/product/10894173,https://static1.bgshop.ru/imagehandler.ashx?width=200&filename=10894173.jpg,Калинина Д.А. ,Скрипичный ключ к счастью,"Юная сыщица Саша осталась без детективного расследования и загрустила. Чтобы развеять хандру, она решила повторить музыкальные композиции Шерлока Холмса на скрипке. Вот тут-то новое расследование и нашло девушку – к Саше по ошибке попала бесценная скрипка, стоящая целое состояние. А на следующую ночь к Саше домой проникли злоумышленники, и инструмент под уникальным именем Ярослава без следа исчез…",Иронические детективы
254,https://www.biblio-globus.ru/product/10894178,https://static1.bgshop.ru/imagehandler.ashx?width=200&filename=10894178.jpg,Александрова Н.Н. ,Украшение китайской бабушки,"Древние китайские легенды рассказывают о прекрасной императрице Сяо Линь, покончившей с собой в день, когда она увидела на своем лице первую морщинку. Эти же легенды утверждают, что императрица обладала удивительным артефактом – Кольцом Змея, которое хранило тайну вечной жизни. Многие века за Кольцом Змея велась охота, но никому так и не удалось его найти. Ну и кому же не захочется навсегда отказаться от старости, морщин, подагры и старческих капризов. Неудивительно, что в современном Петербурге цена за кольцо – чужая жизнь… И, конечно же, и здесь не обошлось без детектива-любительницы Надежды Лебедевой, которая, как и любая женщина, хотела бы скинуть себе годик-другой …",Иронические детективы
255,https://www.biblio-globus.ru/product/10879416,https://static1.bgshop.ru/imagehandler.ashx?width=200&filename=10879416.jpg,Донцова Д.А. ,Голое платье звезды,"Истинное призвание Степаниды Козловой - помогать людям! Но разве могла она предположить, что, пообещав девочке-гимназистке найти ее маму, столкнется с чудовищным обманом и предательством... Успешная владелица риэлторского агентства Вера Чернова попала в СИЗО по обвинению в убийстве. Якобы она отравила двух своих клиенток и украла деньги, отложенные теми на покупку квартир. А в изоляторе временного заключения к ней явился призрак Салтычихи и приказал молчать. История Веры оказалась не только запутанной, но ещё и жуткой... Однако со всем этим Козлова разберётся, а вот известие о неожиданной смерти Романа Звягина - большого друга, владельца фирмы ""Бак"" и, по слухам, жениха Степаниды - просто-таки выбило почву из-под ног...",Иронические детективы
256,https://www.biblio-globus.ru/product/10873666,https://static1.bgshop.ru/imagehandler.ashx?width=200&filename=10873666.jpg,Донцова Д.А. ,Коррида на раздевание,"Это прямо индийское кино какое-то! Никогда не поверишь, что такое может случиться в реальной жизни. Живет себе бывший детдомовец Афанасий Рыбаков, учится, делает блестящую карьеру, строит планы на будущее, и вдруг – бац! Откуда ни возьмись объявляется его мамочка, Алевтина Кирпичникова, которая в доказательство родственных уз демонстрирует на своем животе родимое пятно в виде пчелки. Пятно, надо признать, точь-в-точь такое же, как на животе у самого Афанасия. Вроде, надо радоваться, мать и сын нашли друг друга! Ан нет, что-то настораживает Рыбакова и заставляет его обратиться за помощью к детективам Евлампии Романовой и Максу Вульфу. Лампа приезжает в дом семьи Кирпичниковых, чтобы побеседовать с домочадцами и развеять сомнения молодого человека. Но там она становится свидетельницей внезапной и очень странной смерти Афанасия. Все признаки указывают на то, что Рыбакова отравили. Это уже не индийское кино, а настоящий английский детектив! Голова идет кругом! А тут еще Лампа где-то потеряла младенца, которого ее дочка Киса должна сдать в школу…",Иронические детективы
257,https://www.biblio-globus.ru/product/10862479,https://static1.bgshop.ru/imagehandler.ashx?width=200&filename=10862479.jpg,Донцова Д.А. ,Оберег от испанской страсти,"У Татьяны Сергеевой буквально на носу юбилей мужа! Но где устроить незабываемый праздник и одновременно сюрприз для супруга?! В это же время в офис к начальнице особой бригады явился продюсер Никита Игров. Он поведал, что его протеже – певица Анна Лаврова лежит в больнице в коме, она наглоталась таблеток. Вторая звезда продюсерского центра, рокер Крис Гумби, подозревается в попытке убийства Лавровой, замаскированной под суицид. Никаких серьезных улик против Криса нет, версия полиции основывается на слухах о ненависти рокера к певице, которая легким движением бедра сбросила его с музыкального Олимпа. Крис тоже попал в больницу с микроинсультом... и убежал оттуда. Игров умоляет Татьяну Сергееву найти певца и снять с него подозрения. Задачка непростая! А тут как раз нагрянул юбилей мужа, десятки гостей собрались в ресторане «Веселуха». Согласитесь, говорящее название! Ох, и повеселились все!..",Иронические детективы
258,https://www.biblio-globus.ru/product/10818575,https://static1.bgshop.ru/imagehandler.ashx?width=200&filename=10818575.jpg,Донцова Д.А.,Родословная до седьмого полена,"Ничего себе пердимонокль! Оказывается, рядом с домом любительницы частного сыска Даши Васильевой расположены «графские развалины». Случайно обнаружившая их Даша наткнулась рядом с ними на надгробные плиты и труп молодого мужчины! Конечно, Васильевой к трупам не привыкать! Но это был уже явный перебор, ведь утром того же дня на пороге Дашиного дома скончалась совершенно незнакомая женщина, зачем-то заявившаяся к ней в гости.  Полковник Дегтярев категорически не хочет посвящать Дашу в детали расследования, и любительница частного сыска решает распутать загадочное со всех сторон дело сама и утереть полковнику нос!..",Иронические детективы
